[{"id":"ganesha.mantra.mula","deity":"ganesha","status":"draft","kind":"mantra","text":{"sa":"ॐ गं गणपतये नमः","iast":"oṃ gaṃ gaṇapataye namaḥ","te":"ఓం గం గణపతయే నమః"},"lines":[],"use":["japa","puja"],"count_default":108,"meaning":{"te":"ఓం — గం అనే బీజాక్షరంతో గణపతికి నమస్కారం.","hi":"ॐ — \"गं\" बीज के साथ गणपति को नमस्कार।","en":"Om — salutations to Ganapati, through his seed sound \"gam\"."},"fills":null,"needs_review":false,"audio":{"file":"ganesha.mantra.mula.mp3","length_ms":1224,"words_ms":[0,280,560,860]}},{"id":"ganesha.mantra.shuklambaradharam","deity":"ganesha","status":"draft","kind":"mantra","text":{"sa":"शुक्लाम्बरधरं विष्णुं शशिवर्णं चतुर्भुजम् । प्रसन्नवदनं ध्यायेत् सर्वविघ्नोपशान्तये ॥","iast":"śuklāmbaradharaṃ viṣṇuṃ śaśivarṇaṃ caturbhujam | prasannavadanaṃ dhyāyet sarvavighnopaśāntaye ||","te":"శుక్లామ్బరధరం విష్ణుం శశివర్ణం చతుర్భుజమ్ । ప్రసన్నవదనం ధ్యాయేత్ సర్వవిఘ్నోపశాన్తయే ॥"},"lines":[],"use":["puja"],"count_default":null,"meaning":{"te":"తెల్లని వస్త్రం ధరించినవాడు, అంతటా వ్యాపించినవాడు, చంద్రుని వంటి కాంతి కలవాడు, నాలుగు చేతులవాడు, ప్రసన్నమైన ముఖం కలవాణ్ణి అన్ని విఘ్నాలు తొలగడానికి ధ్యానిస్తాను.","hi":"श्वेत वस्त्रधारी, सर्वव्यापी, चंद्रमा जैसी कांति वाले, चार भुजाओं वाले, प्रसन्न मुख वाले का सभी विघ्नों की शांति के लिए ध्यान करता हूँ।","en":"I meditate on the one dressed in white, present everywhere, bright as the moon, four-armed, with a gentle smiling face — so that every obstacle is removed."},"fills":null,"needs_review":false,"audio":null},{"id":"ganesha.mantra.vakratunda","deity":"ganesha","status":"draft","kind":"mantra","text":{"sa":"वक्रतुण्ड महाकाय सूर्यकोटिसमप्रभ । निर्विघ्नं कुरु मे देव सर्वकार्येषु सर्वदा ॥","iast":"vakratuṇḍa mahākāya sūryakoṭisamaprabha | nirvighnaṃ kuru me deva sarvakāryeṣu sarvadā ||","te":"వక్రతుణ్డ మహాకాయ సూర్యకోటిసమప్రభ । నిర్విఘ్నం కురు మే దేవ సర్వకార్యేషు సర్వదా ॥"},"lines":[],"use":["puja","japa"],"count_default":null,"meaning":{"te":"వంకర తొండం, గొప్ప శరీరం, కోటి సూర్యుల కాంతి కల దేవా, నా అన్ని పనుల్లో ఎప్పుడూ విఘ్నాలు లేకుండా చూడు.","hi":"हे वक्रतुंड, महाकाय, करोड़ों सूर्यों जैसी कांति वाले देव, मेरे सभी कार्यों को सदा निर्विघ्न करो।","en":"O curved-trunked one, mighty, bright as a million suns — keep all my work free of obstacles, always."},"fills":null,"needs_review":false,"audio":null},{"id":"ganesha.mantra.achamanam","deity":"ganesha","status":"draft","kind":"mantra","text":{"sa":"ॐ केशवाय स्वाहा । ॐ नारायणाय स्वाहा । ॐ माधवाय स्वाहा ।","iast":"oṃ keśavāya svāhā | oṃ nārāyaṇāya svāhā | oṃ mādhavāya svāhā |","te":"ఓం కేశవాయ స్వాహా । ఓం నారాయణాయ స్వాహా । ఓం మాధవాయ స్వాహా ।"},"lines":[],"use":["puja"],"count_default":null,"meaning":{"te":"మూడుసార్లు కొద్దిగా నీరు తీసుకుని శుద్ధి చేసుకోవడం.","hi":"तीन बार थोड़ा जल ग्रहण कर स्वयं को शुद्ध करना।","en":"Sipping a little water three times to purify oneself."},"fills":null,"needs_review":true,"audio":null},{"id":"ganesha.mantra.kalasha","deity":"ganesha","status":"draft","kind":"mantra","text":{"sa":"कलशस्य मुखे विष्णुः कण्ठे रुद्रः समाश्रितः । मूले तत्र स्थितो ब्रह्मा मध्ये मातृगणाः स्मृताः ॥","iast":"kalaśasya mukhe viṣṇuḥ kaṇṭhe rudraḥ samāśritaḥ | mūle tatra sthito brahmā madhye mātṛgaṇāḥ smṛtāḥ ||","te":"కలశస్య ముఖే విష్ణుః కణ్ఠే రుద్రః సమాశ్రితః । మూలే తత్ర స్థితో బ్రహ్మా మధ్యే మాతృగణాః స్మృతాః ॥"},"lines":[],"use":["puja"],"count_default":null,"meaning":{"te":"కలశం ముఖంలో విష్ణువు, కంఠంలో రుద్రుడు, మూలంలో బ్రహ్మ, మధ్యలో మాతృగణాలు ఉంటారు.","hi":"कलश के मुख में विष्णु, कंठ में रुद्र, मूल में ब्रह्मा और मध्य में मातृगण विराजते हैं।","en":"Vishnu dwells at the mouth of the kalasha, Rudra at its neck, Brahma at its base, and the Mothers in its middle."},"fills":null,"needs_review":true,"audio":null},{"id":"ganesha.mantra.sankalpam","deity":"ganesha","status":"draft","kind":"mantra","text":{"sa":"ममोपात्त समस्त दुरितक्षयद्वारा श्री परमेश्वर प्रीत्यर्थं शुभे शोभने मुहूर्ते श्री महाविष्णोराज्ञया प्रवर्तमानस्य अद्य ब्रह्मणः द्वितीयपरार्धे श्वेतवराहकल्पे वैवस्वतमन्वन्तरे कलियुगे प्रथमपादे जम्बूद्वीपे भरतवर्षे भरतखण्डे {desha_clause} अस्मिन् वर्तमाने व्यावहारिक चान्द्रमानेन {samvatsara} नाम संवत्सरे {ayana} अयने {ritu} ऋतौ {masa} मासे {paksha} पक्षे {tithi} तिथौ {vasara} वासरे {nakshatra} नक्षत्रे शुभयोगे शुभकरणे एवंगुणविशेषणविशिष्टायां शुभतिथौ {gotra} गोत्रः {name} नामधेयः श्री वरसिद्धिविनायक देवता प्रीत्यर्थं यावच्छक्ति ध्यानावाहनादि षोडशोपचार पूजां करिष्ये ॥","iast":"mamopātta samasta duritakṣayadvārā śrī parameśvara prītyarthaṃ śubhe śobhane muhūrte śrī mahāviṣṇorājñayā pravartamānasya adya brahmaṇaḥ dvitīyaparārdhe śvetavarāhakalpe vaivasvatamanvantare kaliyuge prathamapāde jambūdvīpe bharatavarṣe bharatakhaṇḍe {desha_clause} asmin vartamāne vyāvahārika cāndramānena {samvatsara} nāma saṃvatsare {ayana} ayane {ritu} ṛtau {masa} māse {paksha} pakṣe {tithi} tithau {vasara} vāsare {nakshatra} nakṣatre śubhayoge śubhakaraṇe evaṃguṇaviśeṣaṇaviśiṣṭāyāṃ śubhatithau {gotra} gotraḥ {name} nāmadheyaḥ śrī varasiddhivināyaka devatā prītyarthaṃ yāvacchakti dhyānāvāhanādi ṣoḍaśopacāra pūjāṃ kariṣye ||","te":"మమోపాత్త సమస్త దురితక్షయద్వారా శ్రీ పరమేశ్వర ప్రీత్యర్థం శుభే శోభనే ముహూర్తే శ్రీ మహావిష్ణోరాజ్ఞయా ప్రవర్తమానస్య అద్య బ్రహ్మణః ద్వితీయపరార్ధే శ్వేతవరాహకల్పే వైవస్వతమన్వన్తరే కలియుగే ప్రథమపాదే జమ్బూద్వీపే భరతవర్షే భరతఖణ్డే {desha_clause} అస్మిన్ వర్తమానే వ్యావహారిక చాన్ద్రమానేన {samvatsara} నామ సంవత్సరే {ayana} అయనే {ritu} ఋతౌ {masa} మాసే {paksha} పక్షే {tithi} తిథౌ {vasara} వాసరే {nakshatra} నక్షత్రే శుభయోగే శుభకరణే ఏవంగుణవిశేషణవిశిష్టాయాం శుభతిథౌ {gotra} గోత్రః {name} నామధేయః శ్రీ వరసిద్ధివినాయక దేవతా ప్రీత్యర్థం యావచ్ఛక్తి ధ్యానావాహనాది షోడశోపచార పూజాం కరిష్యే ॥"},"lines":[],"use":[],"count_default":null,"meaning":{"te":"\"ఈ రోజు, ఈ కాలంలో, ఈ ప్రదేశంలో, ఈ పేరుగల నేను వరసిద్ధి వినాయకుని ప్రీతి కోసం నా శక్తి మేరకు పూజ చేస్తాను\" అని సంకల్పం చెప్పుకోవడం. పేరు, గోత్రం తెలియకపోతే వదిలేయవచ్చు.","hi":"\"आज, इस समय, इस स्थान पर, मैं (नाम) वरसिद्धि विनायक की प्रसन्नता के लिए अपनी शक्ति के अनुसार पूजा करूँगा/करूँगी\" — यह संकल्प है। नाम या गोत्र न पता हो तो छोड़ सकते हैं।","en":"A statement of intent: \"Today, at this time and place, I (name) will worship Varasiddhi Vinayaka as well as I can.\" Name and gotra can be left out if not known."},"fills":{"computed":["samvatsara","ayana","ritu","masa","paksha","tithi","vasara","nakshatra"],"user":["gotra","name"],"region":"desha_clause"},"needs_review":true,"audio":null},{"id":"ganesha.mantra.u-dhyanam","deity":"ganesha","status":"draft","kind":"upachara","text":{"sa":"ॐ श्री वरसिद्धिविनायकाय नमः । ध्यायामि ॥","iast":"oṃ śrī varasiddhivināyakāya namaḥ | dhyāyāmi ||","te":"ఓం శ్రీ వరసిద్ధివినాయకాయ నమః । ధ్యాయామి ॥"},"lines":[],"use":["puja"],"count_default":null,"meaning":null,"fills":null,"needs_review":false},{"id":"ganesha.mantra.u-avahanam","deity":"ganesha","status":"draft","kind":"upachara","text":{"sa":"ॐ श्री वरसिद्धिविनायकाय नमः । आवाहयामि ॥","iast":"oṃ śrī varasiddhivināyakāya namaḥ | āvāhayāmi ||","te":"ఓం శ్రీ వరసిద్ధివినాయకాయ నమః । ఆవాహయామి ॥"},"lines":[],"use":["puja"],"count_default":null,"meaning":null,"fills":null,"needs_review":false},{"id":"ganesha.mantra.u-asanam","deity":"ganesha","status":"draft","kind":"upachara","text":{"sa":"ॐ श्री वरसिद्धिविनायकाय नमः । आसनं समर्पयामि ॥","iast":"oṃ śrī varasiddhivināyakāya namaḥ | āsanaṃ samarpayāmi ||","te":"ఓం శ్రీ వరసిద్ధివినాయకాయ నమః । ఆసనం సమర్పయామి ॥"},"lines":[],"use":["puja"],"count_default":null,"meaning":null,"fills":null,"needs_review":false},{"id":"ganesha.mantra.u-padyam","deity":"ganesha","status":"draft","kind":"upachara","text":{"sa":"ॐ श्री वरसिद्धिविनायकाय नमः । पाद्यं समर्पयामि ॥","iast":"oṃ śrī varasiddhivināyakāya namaḥ | pādyaṃ samarpayāmi ||","te":"ఓం శ్రీ వరసిద్ధివినాయకాయ నమః । పాద్యం సమర్పయామి ॥"},"lines":[],"use":["puja"],"count_default":null,"meaning":null,"fills":null,"needs_review":false},{"id":"ganesha.mantra.u-arghyam","deity":"ganesha","status":"draft","kind":"upachara","text":{"sa":"ॐ श्री वरसिद्धिविनायकाय नमः । अर्घ्यं समर्पयामि ॥","iast":"oṃ śrī varasiddhivināyakāya namaḥ | arghyaṃ samarpayāmi ||","te":"ఓం శ్రీ వరసిద్ధివినాయకాయ నమః । అర్ఘ్యం సమర్పయామి ॥"},"lines":[],"use":["puja"],"count_default":null,"meaning":null,"fills":null,"needs_review":false},{"id":"ganesha.mantra.u-achamaniyam","deity":"ganesha","status":"draft","kind":"upachara","text":{"sa":"ॐ श्री वरसिद्धिविनायकाय नमः । आचमनीयं समर्पयामि ॥","iast":"oṃ śrī varasiddhivināyakāya namaḥ | ācamanīyaṃ samarpayāmi ||","te":"ఓం శ్రీ వరసిద్ధివినాయకాయ నమః । ఆచమనీయం సమర్పయామి ॥"},"lines":[],"use":["puja"],"count_default":null,"meaning":null,"fills":null,"needs_review":false},{"id":"ganesha.mantra.u-panchamrita","deity":"ganesha","status":"draft","kind":"upachara","text":{"sa":"ॐ श्री वरसिद्धिविनायकाय नमः । पञ्चामृतस्नानं समर्पयामि ॥","iast":"oṃ śrī varasiddhivināyakāya namaḥ | pañcāmṛtasnānaṃ samarpayāmi ||","te":"ఓం శ్రీ వరసిద్ధివినాయకాయ నమః । పఞ్చామృతస్నానం సమర్పయామి ॥"},"lines":[],"use":["puja"],"count_default":null,"meaning":null,"fills":null,"needs_review":false},{"id":"ganesha.mantra.u-snanam","deity":"ganesha","status":"draft","kind":"upachara","text":{"sa":"ॐ श्री वरसिद्धिविनायकाय नमः । शुद्धोदकस्नानं समर्पयामि ॥","iast":"oṃ śrī varasiddhivināyakāya namaḥ | śuddhodakasnānaṃ samarpayāmi ||","te":"ఓం శ్రీ వరసిద్ధివినాయకాయ నమః । శుద్ధోదకస్నానం సమర్పయామి ॥"},"lines":[],"use":["puja"],"count_default":null,"meaning":null,"fills":null,"needs_review":false},{"id":"ganesha.mantra.u-vastram","deity":"ganesha","status":"draft","kind":"upachara","text":{"sa":"ॐ श्री वरसिद्धिविनायकाय नमः । वस्त्रयुग्मं समर्पयामि ॥","iast":"oṃ śrī varasiddhivināyakāya namaḥ | vastrayugmaṃ samarpayāmi ||","te":"ఓం శ్రీ వరసిద్ధివినాయకాయ నమః । వస్త్రయుగ్మం సమర్పయామి ॥"},"lines":[],"use":["puja"],"count_default":null,"meaning":null,"fills":null,"needs_review":false},{"id":"ganesha.mantra.u-yajnopavitam","deity":"ganesha","status":"draft","kind":"upachara","text":{"sa":"ॐ श्री वरसिद्धिविनायकाय नमः । यज्ञोपवीतं समर्पयामि ॥","iast":"oṃ śrī varasiddhivināyakāya namaḥ | yajñopavītaṃ samarpayāmi ||","te":"ఓం శ్రీ వరసిద్ధివినాయకాయ నమః । యజ్ఞోపవీతం సమర్పయామి ॥"}